{
  "schema_version": 1,
  "id": "RUN-20261006-906",
  "category": "historical",
  "command": [
    "historical-log-import",
    "/tmp/lorcana-boot01-fixes.log"
  ],
  "cwd": "/workspaces/lorcana-online-tcg",
  "environment": {
    "source": "retained prior-session output; exact execution times not available"
  },
  "source_commit": "8c94b274ebd6ad91223cdb6df085ca0597c107c9",
  "source_fingerprint": null,
  "started_at": null,
  "finished_at": null,
  "recorded_at": "2026-10-06T18:54:35.096Z",
  "time_precision": "unknown",
  "expected_exit_code": 0,
  "exit_code": null,
  "signal": null,
  "result": "reported",
  "failure_reason": null,
  "summary": "Retrospective fixes log; historical attempts/results preserved. Source equivalence: docs/validation/boot-01-source-manifest.json. Import time is not execution time; original invocation/exit not reconstructed.",
  "log_path": "docs/validation/logs/RUN-20261006-906.txt",
  "log_sha256": "1358bc2e7fa30b1dbdfd542d9017c0bba6e38d7c547504dfcff2a30fba1e49a5",
  "redactions": 0
}
