{
  "schema_version": 1,
  "id": "RUN-20261006-041",
  "category": "container",
  "command": [
    "pnpm",
    "run",
    "doctor"
  ],
  "cwd": "/workspaces/lorcana-online-tcg/",
  "environment": {
    "node": "24.21.0",
    "pnpm": "10.33.0",
    "platform": "linux",
    "architecture": "x64",
    "user_id": 1000,
    "hostname": "3e5816dff0be"
  },
  "source_commit": "8c94b274ebd6ad91223cdb6df085ca0597c107c9",
  "source_fingerprint": "9d603fb84217ab92567ec38c6cac2435f67ddde36e4c86055c51282ccb9d010f",
  "started_at": "2026-10-06T20:07:02.859Z",
  "finished_at": "2026-10-06T20:07:03.449Z",
  "recorded_at": "2026-10-06T20:07:03.449Z",
  "time_precision": "exact",
  "elapsed_ms": 586,
  "clock_discontinuity": false,
  "expected_exit_code": 0,
  "exit_code": 0,
  "signal": null,
  "result": "passed",
  "failure_reason": null,
  "summary": "Final corrected-source seven pinned toolchain and private environment checks",
  "log_path": "docs/validation/logs/RUN-20261006-041.txt",
  "log_sha256": "eadcd07d924b6bef8a145b80bcf83588d3ba1ebecffeee44671b672d55c84c01",
  "redactions": 0
}
