{
  "schema_version": 1,
  "id": "RUN-20261013-012",
  "category": "container",
  "command": [
    "python3",
    "-I",
    "-c",
    "# Read-only clock diagnostic: wall-minus-monotonic offset every 5 s for 60 s. Changes nothing.\nimport time, json\nt0w, t0m = time.time(), time.monotonic()\nrows = []\nfor i in range(13):\n    if i: time.sleep(5)\n    w, m = time.time(), time.monotonic()\n    rows.append(round(((w - t0w) - (m - t0m)) * 1000, 1))\nprint(json.dumps({'offset_ms_every_5s': rows, 'drift_ms_per_min': round((rows[-1] - rows[0]), 1)}))\nprint('DIAGNOSTIC only: wall-clock minus monotonic offset; not CI acceptance')"
  ],
  "cwd": "/workspaces/lorcana-online-tcg/",
  "environment": {
    "node": "24.21.0",
    "pnpm": "10.33.0",
    "platform": "linux",
    "architecture": "x64",
    "user_id": 1000,
    "hostname": "3e5816dff0be"
  },
  "source_commit": "808de78251ff3df099c2fb2861afb8f98f4ec28e",
  "source_fingerprint": "5f405778696fe4413b4a374f11c966ae7691817a2429136be9519aaeec572689",
  "started_at": "2026-10-13T00:41:55.802Z",
  "finished_at": "2026-10-13T00:42:56.212Z",
  "recorded_at": "2026-10-13T00:42:56.212Z",
  "time_precision": "exact",
  "elapsed_ms": 60067,
  "clock_discontinuity": false,
  "expected_exit_code": 0,
  "exit_code": 0,
  "signal": null,
  "result": "passed",
  "failure_reason": null,
  "summary": "Recorded command outcome",
  "log_path": "docs/validation/logs/RUN-20261013-012.txt",
  "log_sha256": "6dabdf9c3e3b75b6a62f63694901b8394aab2d18487fcf0509e56ddd918405fb",
  "redactions": 0
}
