{
  "schema_version": 1,
  "id": "RUN-20261006-046",
  "category": "static",
  "command": [
    "git",
    "diff",
    "--cached",
    "--check",
    "--",
    ".",
    ":(exclude)docs/validation/logs/**"
  ],
  "cwd": "/workspaces/lorcana-online-tcg/",
  "environment": {
    "node": "24.21.0",
    "pnpm": "10.33.0",
    "platform": "linux",
    "architecture": "x64",
    "user_id": 1000,
    "hostname": "3e5816dff0be"
  },
  "source_commit": "8c94b274ebd6ad91223cdb6df085ca0597c107c9",
  "source_fingerprint": "9d603fb84217ab92567ec38c6cac2435f67ddde36e4c86055c51282ccb9d010f",
  "started_at": "2026-10-06T20:12:22.198Z",
  "finished_at": "2026-10-06T20:12:22.227Z",
  "recorded_at": "2026-10-06T20:12:22.227Z",
  "time_precision": "exact",
  "elapsed_ms": 29,
  "clock_discontinuity": false,
  "expected_exit_code": 0,
  "exit_code": 0,
  "signal": null,
  "result": "passed",
  "failure_reason": null,
  "summary": "Final corrected staged source/document formatting; raw captured logs preserved and digest-validated separately",
  "log_path": "docs/validation/logs/RUN-20261006-046.txt",
  "log_sha256": "e3b0c44298fc1c149afbf4c8996fb92427ae41e4649b934ca495991b7852b855",
  "redactions": 0
}
