{
  "schema_version": 1,
  "id": "RUN-20261020-018",
  "category": "container",
  "command": [
    "pnpm",
    "--filter",
    "@lorcana/design-system",
    "test"
  ],
  "cwd": "/workspaces/lorcana-online-tcg/",
  "environment": {
    "node": "24.21.0",
    "pnpm": "10.33.0",
    "platform": "linux",
    "architecture": "x64",
    "user_id": 1000,
    "hostname": "01ccec184b44"
  },
  "source_commit": "d188387c5e6b19b4bc0ed73a492bb792cadcad76",
  "source_fingerprint": "61698d40ec03dfd6777cb0d15c1a3cb6a86a992ab2ecce8e5b290688c5c522bc",
  "started_at": "2026-10-20T05:39:32.124Z",
  "finished_at": "2026-10-20T05:39:33.113Z",
  "recorded_at": "2026-10-20T05:39:33.113Z",
  "time_precision": "exact",
  "elapsed_ms": 989,
  "clock_discontinuity": false,
  "expected_exit_code": 0,
  "exit_code": 0,
  "signal": null,
  "result": "passed",
  "failure_reason": null,
  "summary": "Design-system gates: DTCG token validation with 10 negative fixtures, 76 contrast pairs, generated-output drift, style ownership, component contracts and state coverage, CSS module types, preferences, messages, font provenance, notice wording, renderer colour spaces and import boundaries",
  "log_path": "docs/validation/logs/RUN-20261020-018.txt",
  "log_sha256": "3a495e73fe4423ed732d92bc56e033a2a9b025ef76e6c2165528e58370a9140a",
  "redactions": 0
}
