{
  "schema_version": 1,
  "id": "RUN-20261013-054",
  "category": "container",
  "command": [
    "node",
    "--input-type=module",
    "-e",
    "// Audit observation (re-run on the refreshed 6de59de1 kernel):\n// the pinned engine's upstream debug \"manual\" moves are not filtered by the\n// server adapter. Characterization only; admission stays closed.\nimport assert from 'node:assert/strict';\nconst A = await import('./packages/engine-adapter/dist/index.js');\nlet n = 0;\nconst m = A.createQualificationMatch({ players: ['p1', 'p2'], startTimestamp: 1000 });\nconst cmd = (actor, move, input = {}) => ({ actor, move, input, timestamp: 2000 + n, expectedRevision: m.status().revision, commandId: 'o' + (n++) });\nconst chooser = m.status().choosingFirstPlayer;\nassert.equal(m.submit(cmd(chooser, 'chooseWhoGoesFirst', { playerId: 'p1' })).accepted, true);\nfor (const p of ['p1', 'p2']) assert.equal(m.submit(cmd(p, 'alterHand', { cardsToMulligan: [] })).accepted, true);\nconst drops = m.submit(cmd('p2', 'manualSetInkDrops', { amount: 99 }));\nconst r = m.submit(cmd('p2', 'manualSetLore', { amount: 20 }));\nconst status = m.status();\nm.dispose();\nconsole.log(JSON.stringify({ observation: 'manual/debug moves submitted by the non-active player through createQualificationMatch on the refreshed kernel', manualSetInkDropsAccepted: drops.accepted, manualSetLoreAccepted: r.accepted, code: r.code, ended: status.ended, winner: status.winner }));\nconsole.log('OBSERVED pre-existing gap: the server adapter forwards upstream manual/debug moves with player authority; PLAY-01 needs a server move allowlist before any real match');"
  ],
  "cwd": "/workspaces/lorcana-online-tcg/",
  "environment": {
    "node": "24.21.0",
    "pnpm": "10.33.0",
    "platform": "linux",
    "architecture": "x64",
    "user_id": 1000,
    "hostname": "3e5816dff0be"
  },
  "source_commit": "1abe9ce202889a372a3336fcf6ea195341be87d7",
  "source_fingerprint": "4ba45cc4ddaf904fe0d3b433ef7884dba981b0dcc10744bd0327e6a7d28a8b0c",
  "started_at": "2026-10-13T15:22:59.775Z",
  "finished_at": "2026-10-13T15:22:59.910Z",
  "recorded_at": "2026-10-13T15:22:59.910Z",
  "time_precision": "exact",
  "elapsed_ms": 135,
  "clock_discontinuity": false,
  "expected_exit_code": 0,
  "exit_code": 0,
  "signal": null,
  "result": "passed",
  "failure_reason": null,
  "summary": "Recorded command outcome",
  "log_path": "docs/validation/logs/RUN-20261013-054.txt",
  "log_sha256": "73c144182265bb05883edeba08798480640bd3b48502115fa5aeda0acc4111ea",
  "redactions": 0
}
