{
  "schema_version": 1,
  "id": "RUN-20261021-016",
  "category": "container",
  "command": [
    "pnpm",
    "ci:design-system"
  ],
  "cwd": "/workspaces/lorcana-online-tcg/",
  "environment": {
    "node": "24.21.0",
    "pnpm": "10.33.0",
    "platform": "linux",
    "architecture": "x64",
    "user_id": 1000,
    "hostname": "e0cc5fff0bb7"
  },
  "source_commit": "8ef329cbb6303a635bb61d3c9364657dc7617fa6",
  "source_fingerprint": "256dd89d31eaa4d8a1594339dd40ec23c3f40a54b45af3d2fa2bb53197396e99",
  "started_at": "2026-10-21T22:30:30.138Z",
  "finished_at": "2026-10-21T22:32:27.661Z",
  "recorded_at": "2026-10-21T22:32:27.661Z",
  "time_precision": "exact",
  "elapsed_ms": 117531,
  "clock_discontinuity": false,
  "expected_exit_code": 0,
  "exit_code": 0,
  "signal": null,
  "result": "passed",
  "failure_reason": null,
  "summary": "Actual isolated design-system pipeline: frozen install, design-system gates, pinned Chromium and the Storybook/Playwright/axe suite",
  "log_path": "docs/validation/logs/RUN-20261021-016.txt",
  "log_sha256": "658c3a323054e9c171c5933a4d4213fbf3582b05cdd3c3615cfaddff44c65a0c",
  "redactions": 0
}
