{
  "schema_version": 1,
  "id": "RUN-20261015-072",
  "category": "static",
  "command": [
    "sh",
    "-c",
    "pnpm docs:sync --change CHG-20261015-003 && pnpm docs:check"
  ],
  "cwd": "/workspaces/lorcana-online-tcg/",
  "environment": {
    "node": "24.21.0",
    "pnpm": "10.33.0",
    "platform": "linux",
    "architecture": "x64",
    "user_id": 1000,
    "hostname": "01ccec184b44"
  },
  "source_commit": "2033396e6058a7eb97aece2605668b9e237a7ab7",
  "source_fingerprint": "afeb6dcd13105029282e7f319ddfe5cfb7d8b4b1d7025f9fb13a094e514d6f9f",
  "started_at": "2026-10-15T15:18:05.575Z",
  "finished_at": "2026-10-15T15:18:51.861Z",
  "recorded_at": "2026-10-15T15:18:51.861Z",
  "time_precision": "exact",
  "elapsed_ms": 46248,
  "clock_discontinuity": false,
  "expected_exit_code": 0,
  "exit_code": 0,
  "signal": null,
  "result": "passed",
  "failure_reason": null,
  "summary": "PLAY-04 complete current documentation synchronization and consistency",
  "log_path": "docs/validation/logs/RUN-20261015-072.txt",
  "log_sha256": "43529a151dbbb0dae547d8bfaf38bfb57089f2508072129c19509583af3d9a49",
  "redactions": 0
}
