{
  "schema_version": 1,
  "id": "RUN-20261012-062",
  "category": "container",
  "command": [
    "node",
    "--test",
    "tests/rules/scenarios.test.mjs"
  ],
  "cwd": "/workspaces/lorcana-online-tcg/",
  "environment": {
    "node": "24.21.0",
    "pnpm": "10.33.0",
    "platform": "linux",
    "architecture": "x64",
    "user_id": 1000,
    "hostname": "3e5816dff0be"
  },
  "source_commit": "82849f4fd0804cd474e8d7afcd5e935b6ac18700",
  "source_fingerprint": "06ae4fbc8462499e7c4a623417fa0d7cdcbc5fc90a28dd4a86cca9c0085782b9",
  "started_at": "2026-10-12T22:08:38.934Z",
  "finished_at": "2026-10-12T22:08:41.182Z",
  "recorded_at": "2026-10-12T22:08:41.182Z",
  "time_precision": "exact",
  "elapsed_ms": 2248,
  "clock_discontinuity": false,
  "expected_exit_code": 0,
  "exit_code": 1,
  "signal": null,
  "result": "failed",
  "failure_reason": null,
  "summary": "RULE-04 corrected vendor closure and all representative regression scenarios",
  "log_path": "docs/validation/logs/RUN-20261012-062.txt",
  "log_sha256": "5cfc447414691820bcbaf882a1886f553c3297911c1390dbddcd6a67dfa2f293",
  "redactions": 0
}
