{
  "schema_version": 1,
  "id": "RUN-20261014-070",
  "category": "static",
  "command": [
    "pnpm",
    "docs:check"
  ],
  "cwd": "/workspaces/lorcana-online-tcg/",
  "environment": {
    "node": "24.21.0",
    "pnpm": "10.33.0",
    "platform": "linux",
    "architecture": "x64",
    "user_id": 1000,
    "hostname": "01ccec184b44"
  },
  "source_commit": "780c26e69c027b6a2afffa5fa43b2df8294cfcf1",
  "source_fingerprint": "e3a9578be616125963591d956509c85eb2b2581912648baed88a62ad2c8d4d6b",
  "started_at": "2026-10-14T20:21:59.896Z",
  "finished_at": "2026-10-14T20:22:11.501Z",
  "recorded_at": "2026-10-14T20:22:11.501Z",
  "time_precision": "exact",
  "elapsed_ms": 11605,
  "clock_discontinuity": false,
  "expected_exit_code": 0,
  "exit_code": 0,
  "signal": null,
  "result": "passed",
  "failure_reason": null,
  "summary": "Independent PLAY-02 audit: documentation, fingerprint, callable, link, changelog and evidence consistency over the finalized audit record",
  "log_path": "docs/validation/logs/RUN-20261014-070.txt",
  "log_sha256": "710511e1d347bfd8a366d9416cea86bd974d1dc99b3afacb1bed35ca6f9dfeea",
  "redactions": 0
}
