{
  "schema_version": 1,
  "id": "RUN-20261010-009",
  "category": "container",
  "command": [
    "pnpm",
    "docs:check"
  ],
  "cwd": "/workspaces/lorcana-online-tcg/",
  "environment": {
    "node": "24.21.0",
    "pnpm": "10.33.0",
    "platform": "linux",
    "architecture": "x64",
    "user_id": 1000,
    "hostname": "3e5816dff0be"
  },
  "source_commit": "3687bedd461ae14ae2b70dac37b140259d407078",
  "source_fingerprint": "8e52e134ba2e4af4195e28c71a93abfe27910fa9b5012ee0550476887e819584",
  "started_at": "2026-10-10T20:59:55.903Z",
  "finished_at": "2026-10-10T21:00:00.651Z",
  "recorded_at": "2026-10-10T21:00:00.651Z",
  "time_precision": "exact",
  "elapsed_ms": 4748,
  "clock_discontinuity": false,
  "expected_exit_code": 0,
  "exit_code": 0,
  "signal": null,
  "result": "passed",
  "failure_reason": null,
  "summary": "BOOT-04 Codex reconciliation: final documentation consistency after recording RUN-007 clock failure and RUN-008 rerun; local Dev Container",
  "log_path": "docs/validation/logs/RUN-20261010-009.txt",
  "log_sha256": "eccfed628fe78843aaced6ff30458b4e8a5e922f6872044c2961beb3c6f29dfc",
  "redactions": 0
}
