{
  "schema_version": 1,
  "id": "RUN-20261014-049",
  "category": "headless_browser",
  "command": [
    "python3",
    "-c",
    "import subprocess; [subprocess.run(c,check=True) for c in [['pnpm','test:e2e:smoke'],['pnpm','test:engine-browser']]]"
  ],
  "cwd": "/workspaces/lorcana-online-tcg/",
  "environment": {
    "node": "24.21.0",
    "pnpm": "10.33.0",
    "platform": "linux",
    "architecture": "x64",
    "user_id": 1000,
    "hostname": "01ccec184b44"
  },
  "source_commit": "3983e1c5907e2a1141de1c3d2484944236e257a8",
  "source_fingerprint": "c13e366e66fdb1d94cace4f266c236ae0135476927ea4e16e588fdff1c6b896d",
  "started_at": "2026-10-14T18:01:56.511Z",
  "finished_at": "2026-10-14T18:02:21.586Z",
  "recorded_at": "2026-10-14T18:02:21.586Z",
  "time_precision": "exact",
  "elapsed_ms": 25075,
  "clock_discontinuity": false,
  "expected_exit_code": 0,
  "exit_code": 0,
  "signal": null,
  "result": "passed",
  "failure_reason": null,
  "summary": "PLAY-02 Linux single-worker Chromium: foundation renderer/protocol and actual public viewer codec, followed by two isolated Lab workers",
  "log_path": "docs/validation/logs/RUN-20261014-049.txt",
  "log_sha256": "595fe5c6d5e051c66e4ab80f3528d120cfbfd4a86f5179c12db7b47315c5a238",
  "redactions": 0
}
