{
  "schema_version": 1,
  "id": "RUN-20261013-002",
  "category": "container",
  "command": [
    "node",
    "scripts/engine/vendor.mjs",
    "--source",
    ".local/rule-01/upstream",
    "--check"
  ],
  "cwd": "/workspaces/lorcana-online-tcg/",
  "environment": {
    "node": "24.21.0",
    "pnpm": "10.33.0",
    "platform": "linux",
    "architecture": "x64",
    "user_id": 1000,
    "hostname": "3e5816dff0be"
  },
  "source_commit": "808de78251ff3df099c2fb2861afb8f98f4ec28e",
  "source_fingerprint": "5f405778696fe4413b4a374f11c966ae7691817a2429136be9519aaeec572689",
  "started_at": "2026-10-13T00:31:27.753Z",
  "finished_at": "2026-10-13T00:31:30.302Z",
  "recorded_at": "2026-10-13T00:31:30.302Z",
  "time_precision": "exact",
  "elapsed_ms": 2550,
  "clock_discontinuity": false,
  "expected_exit_code": 0,
  "exit_code": 0,
  "signal": null,
  "result": "passed",
  "failure_reason": null,
  "summary": "Recorded command outcome",
  "log_path": "docs/validation/logs/RUN-20261013-002.txt",
  "log_sha256": "e143880628f4ae2f4c73f7a29564c87dc7f248d0d79f52cea68384eff49a28df",
  "redactions": 0
}
