{
  "schema_version": 1,
  "id": "RUN-20261022-012",
  "category": "container",
  "command": [
    "sh",
    "-c",
    "pnpm -s --filter @lorcana/design-system typecheck && pnpm -s --filter @lorcana/design-system test"
  ],
  "cwd": "/workspaces/lorcana-online-tcg/",
  "environment": {
    "node": "24.21.0",
    "pnpm": "10.33.0",
    "platform": "linux",
    "architecture": "x64",
    "user_id": 1000,
    "hostname": "01ccec184b44"
  },
  "source_commit": "a4ee8788cd37313195bfe0607ac9f04f29b64b14",
  "source_fingerprint": "6fcbc7a7bbb106b983ef516475719b54ffb6b0269d43e08bacacc39709323c02",
  "started_at": "2026-10-22T14:17:43.060Z",
  "finished_at": "2026-10-22T14:17:47.860Z",
  "recorded_at": "2026-10-22T14:17:47.860Z",
  "time_precision": "exact",
  "elapsed_ms": 4800,
  "clock_discontinuity": false,
  "expected_exit_code": 0,
  "exit_code": 0,
  "signal": null,
  "result": "passed",
  "failure_reason": null,
  "summary": "UX-01 task 2: design-system typecheck and gates (tokens, styles, component contracts with CardBack, card-back provenance)",
  "log_path": "docs/validation/logs/RUN-20261022-012.txt",
  "log_sha256": "745486acb1b4c16448ab53b4d50f8c1518eff9d386dce9f524f7f277d7c16bf2",
  "redactions": 0
}
