{
  "schema_version": 1,
  "id": "RUN-20261016-018",
  "category": "container",
  "command": [
    "sh",
    "-c",
    "d=$(mktemp -d /tmp/audit-clean-XXXXXX) && trap \"rm -rf $d\" EXIT && git archive --format=tar HEAD | tar -x -C \"$d\" && test ! -e \"$d/apps/match-service/dist\" && test ! -e \"$d/node_modules\" && cd \"$d\" && env -i PATH=\"$PATH\" HOME=\"$HOME\" CI=1 pnpm install --frozen-lockfile --offline >/dev/null && env -i PATH=\"$PATH\" HOME=\"$HOME\" CI=1 pnpm typecheck && test ! -e apps/match-service/dist && echo \"PASS clean archive: no app build output before or after; typecheck exit 0\""
  ],
  "cwd": "/workspaces/lorcana-online-tcg/",
  "environment": {
    "node": "24.21.0",
    "pnpm": "10.33.0",
    "platform": "linux",
    "architecture": "x64",
    "user_id": 1000,
    "hostname": "01ccec184b44"
  },
  "source_commit": "da050d5fded198dbd8a62dad7663b71442e01107",
  "source_fingerprint": "168d05d74f9bba68200c53bf1fa9391bdfb296184be22a511a59c9381bdf23ef",
  "started_at": "2026-10-16T18:03:14.764Z",
  "finished_at": "2026-10-16T18:03:43.176Z",
  "recorded_at": "2026-10-16T18:03:43.176Z",
  "time_precision": "clock_discontinuous",
  "elapsed_ms": 31015,
  "clock_discontinuity": true,
  "expected_exit_code": 0,
  "exit_code": 0,
  "signal": null,
  "result": "failed",
  "failure_reason": "clock_changed",
  "summary": "PLAY-04 opening-fix re-check: git archive of da050d5 into an empty directory, frozen offline install and root typecheck with no app build output (R2)",
  "log_path": "docs/validation/logs/RUN-20261016-018.txt",
  "log_sha256": "accea78510b2e6a9bc709a125811169b959931acf5756d762869e8a5c90f6ce3",
  "redactions": 0
}
