{
  "schema_version": 1,
  "id": "RUN-20261013-082",
  "category": "container",
  "command": [
    "bash",
    "-c",
    "pnpm --filter @lorcana/match-service build && pnpm test:match-integration && pnpm db:migrate -- --target local && pnpm db:health -- --target local && pnpm db:health -- --target test && pnpm db:check"
  ],
  "cwd": "/workspaces/lorcana-online-tcg/",
  "environment": {
    "node": "24.21.0",
    "pnpm": "10.33.0",
    "platform": "linux",
    "architecture": "x64",
    "user_id": 1000,
    "hostname": "3e5816dff0be"
  },
  "source_commit": "9b9c8ac09bf1024f629e47eb3fb2a1adf729d9b8",
  "source_fingerprint": "d2a81ca8a70a278baef5781c49f0fcf980089248754f38c59c7f35fe56a6cd7b",
  "started_at": "2026-10-13T18:05:02.789Z",
  "finished_at": "2026-10-13T18:05:20.019Z",
  "recorded_at": "2026-10-13T18:05:20.019Z",
  "time_precision": "exact",
  "elapsed_ms": 17206,
  "clock_discontinuity": false,
  "expected_exit_code": 0,
  "exit_code": 0,
  "signal": null,
  "result": "passed",
  "failure_reason": null,
  "summary": "Reviewed creation input rejects nested accessors without invoking them; local additive migration and both restricted identity sets",
  "log_path": "docs/validation/logs/RUN-20261013-082.txt",
  "log_sha256": "1ca8d6aa4d3c7f3cfaaaf60b7c72a3826ccf884a9315657de1f39915ce54dc28",
  "redactions": 0
}
