{
  "schema_version": 1,
  "id": "RUN-20261012-089",
  "category": "container",
  "command": [
    "pnpm",
    "ci:verify"
  ],
  "cwd": "/workspaces/lorcana-online-tcg/",
  "environment": {
    "node": "24.21.0",
    "pnpm": "10.33.0",
    "platform": "linux",
    "architecture": "x64",
    "user_id": 1000,
    "hostname": "f09e4a88c665"
  },
  "source_commit": "82849f4fd0804cd474e8d7afcd5e935b6ac18700",
  "source_fingerprint": "5f405778696fe4413b4a374f11c966ae7691817a2429136be9519aaeec572689",
  "started_at": "2026-10-12T22:44:12.533Z",
  "finished_at": "2026-10-12T22:48:19.094Z",
  "recorded_at": "2026-10-12T22:48:19.094Z",
  "time_precision": "clock_discontinuous",
  "elapsed_ms": 245414,
  "clock_discontinuity": true,
  "expected_exit_code": 0,
  "exit_code": 0,
  "signal": null,
  "result": "failed",
  "failure_reason": "clock_changed",
  "summary": "Actual isolated BOOT-03 pipeline: frozen foundation, live PostgreSQL, Linux browser, dependency/secret scans and artifacts",
  "log_path": "docs/validation/logs/RUN-20261012-089.txt",
  "log_sha256": "c7a2875d23524191c926ee9eb97d03912fa609a9cad86d8b794c7dd18ee26653",
  "redactions": 0
}
